title,image_url,product_link,inner_product_description,inner_feature_description,table_details
Tyson 2.0 Lightweight Disposable Vape 6K,https://cdn11.bigcommerce.com/s-hqim8tz8ly/products/72437/images/118627/Tyson_2.0_Lightweight_Vapae_6K_19__37287.1736945522.386.513.jpg?c=2,https://vaperanger.com/products/tyson-2-0-lightweight-vape-6k,"Compact yet powerful, the Tyson 2.0 Lightweight Disposable Vape 6K offers the ultimate vaping experience with 6000 total puffs across three devices. Each vape features 4ml of 5% nicotine salt e-liquid, ensuring strong, smooth hits. Advanced Fyre Mesh Coil technology enhances flavor consistency, while the rechargeable 550mAh battery provides reliable performance. With vibrant flavor options like Strawberry Watermelon and Cool Mint, this disposable vape is a must-have for flavor enthusiasts who value portability and convenience.","['Puff Count: Each pack contains three disposables, offering 2000 puffs per vape for a total of 6000 puffs.', 'Nicotine Strength: 5% (50mg) nicotine salt for a strong and satisfying hit.', 'E-Liquid Capacity: Each device holds 4ml of e-liquid, with 12ml in total across the pack.', 'Advanced Fyre Mesh Coil: Provides consistent heating for smooth, flavorful puffs.', 'Rechargeable Battery: 550mAh battery ensures reliable performance, perfect for extended use.', 'Flavor Options: Includes fruity and refreshing blends like Apple Peach, Strawberry Watermelon, Cool Mint, and Frozen Blueberry.', 'Portable and Convenient: Lightweight, easy-to-carry design for on-the-go vapers.', 'Quality Commitment: Built to deliver flavor, longevity, and reliability in every puff.', 'Apple Peach: Crisp apples and sweet peaches combine for a refreshing fruity treat.', 'Blue Razz: Tangy blue raspberry with bold, sweet undertones.', 'Cool Mint: Invigorating mint with a frosty finish.', 'Frozen Banana: Creamy banana meets icy menthol for a tropical chill.', 'Frozen Blueberry: Sweet blueberries paired with a frosty burst.', 'Frozen Grape: Juicy grapes enhanced with a refreshing icy twist.', 'Frozen Mango: Tropical mangoes cooled with frosty menthol.', 'Frozen Mix: A fruity medley layered with a refreshing menthol kick.', 'Frozen Peach: Succulent peach infused with icy menthol.', 'Frozen Strawberry: Juicy strawberries enhanced with frosty menthol.', 'Green Apple: Tart, crisp green apples for a tangy punch.', 'Grape Razz: Bold grape meets tangy raspberry for a sweet-tart delight.', 'Lush Freeze: Juicy watermelon with a menthol chill.', 'Mint Mix: A refreshing blend of mint flavors.', 'OG Mix: A nostalgic blend of classic flavors.', 'Peach Mango: Sweet peach and tropical mango for a smooth fusion.', 'Peach Watermelon: Lush peach meets juicy watermelon for a summer treat.', 'Raspberry Watermelon: Tart raspberries and sweet watermelon combine perfectly.', 'Strawberry Banana: Sweet strawberries and creamy bananas for a dessert-inspired vape.', 'Strawberry Watermelon: Juicy strawberry and refreshing watermelon blend beautifully.', 'Very Berry: A vibrant medley of mixed berries for fruity bliss.', 'VIP Mix: A luxurious mix of exotic fruits for a premium experience.', 'Watermelon: Sweet, juicy watermelon captures summertime vibes.']","[{'flavor': 'Peach Mango', 'nicotine': '50MG', 'pack count': '5 Pack', 'pieces': '3 Pieces', 'size': '4ml', 'price': '$51.67', 'stock': 14, 'quantity': 'Decrease Quantity of Tyson 2.0 Lightweight Disposable Vape 6K\nIncrease Quantity of Tyson 2.0 Lightweight Disposable Vape 6K'}, {'flavor': 'OG Mix', 'nicotine': '50MG', 'pack count': '5 Pack', 'pieces': '3 Pieces', 'size': '4ml', 'price': '$51.67', 'stock': 14, 'quantity': 'Decrease Quantity of Tyson 2.0 Lightweight Disposable Vape 6K\nIncrease Quantity of Tyson 2.0 Lightweight Disposable Vape 6K'}, {'flavor': 'Green Apple', 'nicotine': '50MG', 'pack count': '5 Pack', 'pieces': '3 Pieces', 'size': '4ml', 'price': '$51.67', 'stock': 8, 'quantity': 'Decrease Quantity of Tyson 2.0 Lightweight Disposable Vape 6K\nIncrease Quantity of Tyson 2.0 Lightweight Disposable Vape 6K'}, {'flavor': 'Apple Peach', 'nicotine': '50MG', 'pack count': '5 Pack', 'pieces': '3 Pieces', 'size': '4ml', 'price': '$51.67', 'stock': 8, 'quantity': 'Decrease Quantity of Tyson 2.0 Lightweight Disposable Vape 6K\nIncrease Quantity of Tyson 2.0 Lightweight Disposable Vape 6K'}, {'flavor': 'Peach Watermelon', 'nicotine': '50MG', 'pack count': '5 Pack', 'pieces': '3 Pieces', 'size': '4ml', 'price': '$51.67', 'stock': 7, 'quantity': 'Decrease Quantity of Tyson 2.0 Lightweight Disposable Vape 6K\nIncrease Quantity of Tyson 2.0 Lightweight Disposable Vape 6K'}, {'flavor': 'Very Berry', 'nicotine': '50MG', 'pack count': '5 Pack', 'pieces': '3 Pieces', 'size': '4ml', 'price': '$51.67', 'stock': 6, 'quantity': 'Decrease Quantity of Tyson 2.0 Lightweight Disposable Vape 6K\nIncrease Quantity of Tyson 2.0 Lightweight Disposable Vape 6K'}, {'flavor': 'Grape Razz', 'nicotine': '50MG', 'pack count': '5 Pack', 'pieces': '3 Pieces', 'size': '4ml', 'price': '$51.67', 'stock': 6, 'quantity': 'Decrease Quantity of Tyson 2.0 Lightweight Disposable Vape 6K\nIncrease Quantity of Tyson 2.0 Lightweight Disposable Vape 6K'}, {'flavor': 'Strawberry Banana', 'nicotine': '50MG', 'pack count': '5 Pack', 'pieces': '3 Pieces', 'size': '4ml', 'price': '$51.67', 'stock': 5, 'quantity': 'Decrease Quantity of Tyson 2.0 Lightweight Disposable Vape 6K\nIncrease Quantity of Tyson 2.0 Lightweight Disposable Vape 6K'}, {'flavor': 'Frozen Banana', 'nicotine': '50MG', 'pack count': '5 Pack', 'pieces': '3 Pieces', 'size': '4ml', 'price': '$51.67', 'stock': 4, 'quantity': 'Decrease Quantity of Tyson 2.0 Lightweight Disposable Vape 6K\nIncrease Quantity of Tyson 2.0 Lightweight Disposable Vape 6K'}, {'flavor': 'Raspberry Watermelon', 'nicotine': '50MG', 'pack count': '5 Pack', 'pieces': '3 Pieces', 'size': '4ml', 'price': '$51.67', 'stock': 3, 'quantity': 'Decrease Quantity of Tyson 2.0 Lightweight Disposable Vape 6K\nIncrease Quantity of Tyson 2.0 Lightweight Disposable Vape 6K'}, {'flavor': 'Frozen Peach', 'nicotine': '50MG', 'pack count': '5 Pack', 'pieces': '3 Pieces', 'size': '4ml', 'price': '$51.67', 'stock': 3, 'quantity': 'Decrease Quantity of Tyson 2.0 Lightweight Disposable Vape 6K\nIncrease Quantity of Tyson 2.0 Lightweight Disposable Vape 6K'}, {'flavor': 'Frozen Mango', 'nicotine': '50MG', 'pack count': '5 Pack', 'pieces': '3 Pieces', 'size': '4ml', 'price': '$51.67', 'stock': 3, 'quantity': 'Decrease Quantity of Tyson 2.0 Lightweight Disposable Vape 6K\nIncrease Quantity of Tyson 2.0 Lightweight Disposable Vape 6K'}, {'flavor': 'Blue Razz', 'nicotine': '50MG', 'pack count': '5 Pack', 'pieces': '3 Pieces', 'size': '4ml', 'price': '$51.67', 'stock': 3, 'quantity': 'Decrease Quantity of Tyson 2.0 Lightweight Disposable Vape 6K\nIncrease Quantity of Tyson 2.0 Lightweight Disposable Vape 6K'}, {'flavor': 'Watermelon', 'nicotine': '50MG', 'pack count': '5 Pack', 'pieces': '3 Pieces', 'size': '4ml', 'price': '$51.67', 'stock': 'Unavailable', 'quantity': 'Notify Me'}, {'flavor': 'Strawberry Watermelon', 'nicotine': '50MG', 'pack count': '5 Pack', 'pieces': '3 Pieces', 'size': '4ml', 'price': '$51.67', 'stock': 'Unavailable', 'quantity': 'Notify Me'}, {'flavor': 'Mint Mix', 'nicotine': '50MG', 'pack count': '5 Pack', 'pieces': '3 Pieces', 'size': '4ml', 'price': '$51.67', 'stock': 'Unavailable', 'quantity': 'Notify Me'}, {'flavor': 'Lush Freeze', 'nicotine': '50MG', 'pack count': '5 Pack', 'pieces': '3 Pieces', 'size': '4ml', 'price': '$51.67', 'stock': 'Unavailable', 'quantity': 'Notify Me'}, {'flavor': 'Frozen Strawberry', 'nicotine': '50MG', 'pack count': '5 Pack', 'pieces': '3 Pieces', 'size': '4ml', 'price': '$51.67', 'stock': 'Unavailable', 'quantity': 'Notify Me'}, {'flavor': 'Frozen Mix', 'nicotine': '50MG', 'pack count': '5 Pack', 'pieces': '3 Pieces', 'size': '4ml', 'price': '$51.67', 'stock': 'Unavailable', 'quantity': 'Notify Me'}, {'flavor': 'Frozen Grape', 'nicotine': '50MG', 'pack count': '5 Pack', 'pieces': '3 Pieces', 'size': '4ml', 'price': '$51.67', 'stock': 'Unavailable', 'quantity': 'Notify Me'}, {'flavor': 'Frozen Blueberry', 'nicotine': '50MG', 'pack count': '5 Pack', 'pieces': '3 Pieces', 'size': '4ml', 'price': '$51.67', 'stock': 'Unavailable', 'quantity': 'Notify Me'}, {'flavor': 'Cool Mint', 'nicotine': '50MG', 'pack count': '5 Pack', 'pieces': '3 Pieces', 'size': '4ml', 'price': '$51.67', 'stock': 'Unavailable', 'quantity': 'Notify Me'}]"
FLONQ Max Pro Vape,https://cdn11.bigcommerce.com/s-hqim8tz8ly/products/72392/images/118299/1__01403.1734983616.386.513.jpg?c=2,https://vaperanger.com/products/flonq-max-pro-vape,"The FLONQ Max Pro Vape combines cutting-edge features with sleek aesthetics. With 18ml of e-liquid and 20mg or 50mg nicotine options, it delivers over 20,000 puffs. Its dual mesh coil ensures rich, consistent flavor, while the boost mode elevates performance. A rechargeable 650mAh battery and an LED screen displaying battery, power, and e-liquid levels make it user-friendly. Perfect for those seeking a stylish and reliable vape.","['E-liquid contents: 18ml', 'Nicotine Levels: 20mg / 50mg', 'Puffs per Device: +20000', 'Battery: 650mAh (Rechargeable via USB-C)', 'Master Case Qty: 200', 'Coil: Dual Mesh Coil', 'Boost Mode Option', 'LED Screen: Displays Power Mode, e-Liquid, and Battery Indicators', 'Banana Milkshake: Creamy banana with a sweet finish.', 'Blue Razz Icy: Tangy blue raspberry with a cool touch.', 'Blueberry Lemonade: Sweet blueberry meets tart lemonade.', 'Cherry Lemon: Juicy cherries with a citrusy twist.', 'Clear: Pure and smooth flavor.', 'Grape Icy: Frosty, sweet grape.', 'Mango Icy: Sweet mango with a chilly finish.', 'Miami Mint: Refreshing mint with tropical vibes.', 'Milk Chocolate: Decadent and creamy chocolate.', 'Peach Icy: Juicy peach with a frosty edge.', 'Pineapple Coconut: Tropical blend of pineapple and coconut.', 'Strawberry Ice Cream: Creamy strawberry dessert.', 'Strawberry Kiwi: Sweet strawberries with tangy kiwi.', 'Strawberry Watermelon: Juicy and sweet fruit medley.', 'Tobacco: Bold and classic tobacco.', 'Watermelon Icy: Refreshing watermelon with icy coolness.', 'White Gummy: Sweet gummy candy flavor.']","[{'flavor': 'Blue Razz Icy', 'nicotine': '20MG', 'pack count': '5 Pack', 'size': '18ml', 'price': '$46.6', 'stock': 1893, 'quantity': 'Decrease Quantity of FLONQ Max Pro Vape\nIncrease Quantity of FLONQ Max Pro Vape'}, {'flavor': 'Strawberry Kiwi', 'nicotine': '20MG', 'pack count': '5 Pack', 'size': '18ml', 'price': '$46.6', 'stock': 1608, 'quantity': 'Decrease Quantity of FLONQ Max Pro Vape\nIncrease Quantity of FLONQ Max Pro Vape'}, {'flavor': 'Blueberry Lemonade', 'nicotine': '20MG', 'pack count': '5 Pack', 'size': '18ml', 'price': '$46.6', 'stock': 1504, 'quantity': 'Decrease Quantity of FLONQ Max Pro Vape\nIncrease Quantity of FLONQ Max Pro Vape'}, {'flavor': 'Miami Mint', 'nicotine': '20MG', 'pack count': '5 Pack', 'size': '18ml', 'price': '$46.6', 'stock': 1431, 'quantity': 'Decrease Quantity of FLONQ Max Pro Vape\nIncrease Quantity of FLONQ Max Pro Vape'}, {'flavor': 'Strawberry Watermelon', 'nicotine': '20MG', 'pack count': '5 Pack', 'size': '18ml', 'price': '$46.6', 'stock': 1429, 'quantity': 'Decrease Quantity of FLONQ Max Pro Vape\nIncrease Quantity of FLONQ Max Pro Vape'}, {'flavor': 'Cherry Lemon', 'nicotine': '20MG', 'pack count': '5 Pack', 'size': '18ml', 'price': '$46.6', 'stock': 1324, 'quantity': 'Decrease Quantity of FLONQ Max Pro Vape\nIncrease Quantity of FLONQ Max Pro Vape'}, {'flavor': 'Peach Icy', 'nicotine': '20MG', 'pack count': '5 Pack', 'size': '18ml', 'price': '$46.6', 'stock': 1109, 'quantity': 'Decrease Quantity of FLONQ Max Pro Vape\nIncrease Quantity of FLONQ Max Pro Vape'}, {'flavor': 'Pineapple Coconut', 'nicotine': '50MG', 'pack count': '5 Pack', 'size': '18ml', 'price': '$46.6', 'stock': 1104, 'quantity': 'Decrease Quantity of FLONQ Max Pro Vape\nIncrease Quantity of FLONQ Max Pro Vape'}, {'flavor': 'Watermelon Icy', 'nicotine': '20MG', 'pack count': '5 Pack', 'size': '18ml', 'price': '$46.6', 'stock': 1067, 'quantity': 'Decrease Quantity of FLONQ Max Pro Vape\nIncrease Quantity of FLONQ Max Pro Vape'}, {'flavor': 'Pineapple Coconut', 'nicotine': '20MG', 'pack count': '5 Pack', 'size': '18ml', 'price': '$46.6', 'stock': 986, 'quantity': 'Decrease Quantity of FLONQ Max Pro Vape\nIncrease Quantity of FLONQ Max Pro Vape'}, {'flavor': 'Cherry Lemon', 'nicotine': '50MG', 'pack count': '5 Pack', 'size': '18ml', 'price': '$46.6', 'stock': 965, 'quantity': 'Decrease Quantity of FLONQ Max Pro Vape\nIncrease Quantity of FLONQ Max Pro Vape'}, {'flavor': 'Watermelon Icy', 'nicotine': '50MG', 'pack count': '5 Pack', 'size': '18ml', 'price': '$46.6', 'stock': 879, 'quantity': 'Decrease Quantity of FLONQ Max Pro Vape\nIncrease Quantity of FLONQ Max Pro Vape'}, {'flavor': 'White Gummy', 'nicotine': '20MG', 'pack count': '5 Pack', 'size': '18ml', 'price': '$46.6', 'stock': 858, 'quantity': 'Decrease Quantity of FLONQ Max Pro Vape\nIncrease Quantity of FLONQ Max Pro Vape'}, {'flavor': 'Blue Razz Icy', 'nicotine': '50MG', 'pack count': '5 Pack', 'size': '18ml', 'price': '$46.6', 'stock': 833, 'quantity': 'Decrease Quantity of FLONQ Max Pro Vape\nIncrease Quantity of FLONQ Max Pro Vape'}, {'flavor': 'Strawberry Kiwi', 'nicotine': '50MG', 'pack count': '5 Pack', 'size': '18ml', 'price': '$46.6', 'stock': 778, 'quantity': 'Decrease Quantity of FLONQ Max Pro Vape\nIncrease Quantity of FLONQ Max Pro Vape'}, {'flavor': 'Tobacco', 'nicotine': '50MG', 'pack count': '5 Pack', 'size': '18ml', 'price': '$46.6', 'stock': 739, 'quantity': 'Decrease Quantity of FLONQ Max Pro Vape\nIncrease Quantity of FLONQ Max Pro Vape'}, {'flavor': 'Banana Milkshake', 'nicotine': '50MG', 'pack count': '5 Pack', 'size': '18ml', 'price': '$46.6', 'stock': 709, 'quantity': 'Decrease Quantity of FLONQ Max Pro Vape\nIncrease Quantity of FLONQ Max Pro Vape'}, {'flavor': 'Strawberry Watermelon', 'nicotine': '50MG', 'pack count': '5 Pack', 'size': '18ml', 'price': '$46.6', 'stock': 667, 'quantity': 'Decrease Quantity of FLONQ Max Pro Vape\nIncrease Quantity of FLONQ Max Pro Vape'}, {'flavor': 'Mango Icy', 'nicotine': '50MG', 'pack count': '5 Pack', 'size': '18ml', 'price': '$46.6', 'stock': 656, 'quantity': 'Decrease Quantity of FLONQ Max Pro Vape\nIncrease Quantity of FLONQ Max Pro Vape'}, {'flavor': 'Blueberry Lemonade', 'nicotine': '50MG', 'pack count': '5 Pack', 'size': '18ml', 'price': '$46.6', 'stock': 626, 'quantity': 'Decrease Quantity of FLONQ Max Pro Vape\nIncrease Quantity of FLONQ Max Pro Vape'}, {'flavor': 'Miami Mint', 'nicotine': '50MG', 'pack count': '5 Pack', 'size': '18ml', 'price': '$46.6', 'stock': 610, 'quantity': 'Decrease Quantity of FLONQ Max Pro Vape\nIncrease Quantity of FLONQ Max Pro Vape'}, {'flavor': 'Clear', 'nicotine': '50MG', 'pack count': '5 Pack', 'size': '18ml', 'price': '$46.6', 'stock': 541, 'quantity': 'Decrease Quantity of FLONQ Max Pro Vape\nIncrease Quantity of FLONQ Max Pro Vape'}, {'flavor': 'Peach Icy', 'nicotine': '50MG', 'pack count': '5 Pack', 'size': '18ml', 'price': '$46.6', 'stock': 528, 'quantity': 'Decrease Quantity of FLONQ Max Pro Vape\nIncrease Quantity of FLONQ Max Pro Vape'}, {'flavor': 'Grape Icy', 'nicotine': '50MG', 'pack count': '5 Pack', 'size': '18ml', 'price': '$46.6', 'stock': 459, 'quantity': 'Decrease Quantity of FLONQ Max Pro Vape\nIncrease Quantity of FLONQ Max Pro Vape'}, {'flavor': 'Milk Chocolate', 'nicotine': '50MG', 'pack count': '5 Pack', 'size': '18ml', 'price': '$46.6', 'stock': 'Unavailable', 'quantity': 'Notify Me'}]"
