title,image_url,product_link,inner_product_description,inner_feature_description,table_details
Artery CL6 Sweet & Ice Control Vape,https://cdn11.bigcommerce.com/s-hqim8tz8ly/products/72384/images/118254/Artery_CL6_Sweet_Ice_Control_Vape__03285.1734550697.386.513.jpg?c=2,https://vaperanger.com/products/artery-cl6-sweet-ice-control-vape,"The Artery CL6 Sweet & Ice Control Vape combines 50,000 puffs with advanced Tri-Fusion Technology for ultimate customization. Adjust sweetness, ice levels, and airflow to fit personal preferences. Featuring quad mesh coils with V-PRO technology, this device delivers smooth, consistent flavor. Its 26mL e-liquid capacity and rechargeable 1,150mAh battery make it a reliable, long-lasting choice. With a sleek display screen, users can monitor battery life, sweetness, and more with ease.","['50,000 Puffs: Long-lasting device, perfect for high-volume use.', 'Tri-Fusion Technology: Customizes sweetness and ice levels for a personalized experience.', 'Quad Mesh Coils with V-PRO Technology: Delivers consistent, smooth flavor.', 'Adjustable Airflow: Fine-tune your draw for maximum satisfaction.', 'Large E-Liquid Capacity: 26mL of e-liquid with 50mg/ml nicotine strength.', 'Rechargeable Battery: 1,150mAh with USB Type-C for easy recharging.', 'Stealthy Display Screen: Tracks ice, sweetness, battery, and e-liquid levels.', '5 Ice Levels: Adjust the cooling intensity from mild to intense.', '4 Sweetness Levels: Customize sweetness for a subtle or rich taste.', 'Black Cherry: A sweet, juicy cherry flavor with a refreshing ice finish.', 'Blue Razz: A tangy and tart blue raspberry flavor, perfectly balanced with a cool sensation.', 'Blueberry Watermelon: A fruity fusion of sweet blueberries and refreshing watermelon, topped with a touch of ice.', 'Miami Mint: A tropical minty blend with a crisp, cooling effect, ideal for refreshing vapes.', 'Orange Cranberry Berries: A zesty mix of tangy oranges, cranberries, and sweet berries with a chilled finish.', 'Peach: A smooth, succulent peach flavor with a frosty kick for a satisfying vape.', 'Strawberry Banana: A creamy and fruity blend of ripe strawberries and bananas, with a cooling sensation.', 'Strawberry Cherry Raspberry: A vibrant blend of strawberry, cherry, and raspberry, complemented by a cool exhale.', 'Sour Apple: A tart and tangy sour apple flavor with a burst of icy refreshment.', 'Vimto: A unique and fruity concoction of mixed berries and grape with a refreshing ice aftertaste.', 'Watermelon Lemon Gummy: A sweet and sour watermelon lemon gummy flavor with an icy exhale.', 'White Gummy: A sweet, candy-like gummy flavor with a cooling effect for a nostalgic treat.']","[{'flavor': 'Orange Cranberry Berries', 'nicotine': '50MG', 'pack count': '5 Pack', 'size': '26ml', 'price': '$46.7', 'stock': 300, 'quantity': 'Decrease Quantity of Artery CL6 Sweet & Ice Control Vape\nIncrease Quantity of Artery CL6 Sweet & Ice Control Vape'}, {'flavor': 'Sour Apple', 'nicotine': '50MG', 'pack count': '5 Pack', 'size': '26ml', 'price': '$46.7', 'stock': 260, 'quantity': 'Decrease Quantity of Artery CL6 Sweet & Ice Control Vape\nIncrease Quantity of Artery CL6 Sweet & Ice Control Vape'}, {'flavor': 'Black Cherry', 'nicotine': '50MG', 'pack count': '5 Pack', 'size': '26ml', 'price': '$46.7', 'stock': 250, 'quantity': 'Decrease Quantity of Artery CL6 Sweet & Ice Control Vape\nIncrease Quantity of Artery CL6 Sweet & Ice Control Vape'}, {'flavor': 'Vimto', 'nicotine': '50MG', 'pack count': '5 Pack', 'size': '26ml', 'price': '$46.7', 'stock': 249, 'quantity': 'Decrease Quantity of Artery CL6 Sweet & Ice Control Vape\nIncrease Quantity of Artery CL6 Sweet & Ice Control Vape'}, {'flavor': 'Miami Mint', 'nicotine': '50MG', 'pack count': '5 Pack', 'size': '26ml', 'price': '$46.7', 'stock': 235, 'quantity': 'Decrease Quantity of Artery CL6 Sweet & Ice Control Vape\nIncrease Quantity of Artery CL6 Sweet & Ice Control Vape'}, {'flavor': 'White Gummy', 'nicotine': '50MG', 'pack count': '5 Pack', 'size': '26ml', 'price': '$46.7', 'stock': 223, 'quantity': 'Decrease Quantity of Artery CL6 Sweet & Ice Control Vape\nIncrease Quantity of Artery CL6 Sweet & Ice Control Vape'}, {'flavor': 'Strawberry Cherry Raspberry', 'nicotine': '50MG', 'pack count': '5 Pack', 'size': '26ml', 'price': '$46.7', 'stock': 206, 'quantity': 'Decrease Quantity of Artery CL6 Sweet & Ice Control Vape\nIncrease Quantity of Artery CL6 Sweet & Ice Control Vape'}, {'flavor': 'Strawberry Banana', 'nicotine': '50MG', 'pack count': '5 Pack', 'size': '26ml', 'price': '$46.7', 'stock': 198, 'quantity': 'Decrease Quantity of Artery CL6 Sweet & Ice Control Vape\nIncrease Quantity of Artery CL6 Sweet & Ice Control Vape'}, {'flavor': 'Peach', 'nicotine': '50MG', 'pack count': '5 Pack', 'size': '26ml', 'price': '$46.7', 'stock': 187, 'quantity': 'Decrease Quantity of Artery CL6 Sweet & Ice Control Vape\nIncrease Quantity of Artery CL6 Sweet & Ice Control Vape'}, {'flavor': 'Watermelon Lemon Gummy', 'nicotine': '50MG', 'pack count': '5 Pack', 'size': '26ml', 'price': '$46.7', 'stock': 183, 'quantity': 'Decrease Quantity of Artery CL6 Sweet & Ice Control Vape\nIncrease Quantity of Artery CL6 Sweet & Ice Control Vape'}, {'flavor': 'Blue Razz', 'nicotine': '50MG', 'pack count': '5 Pack', 'size': '26ml', 'price': '$46.7', 'stock': 142, 'quantity': 'Decrease Quantity of Artery CL6 Sweet & Ice Control Vape\nIncrease Quantity of Artery CL6 Sweet & Ice Control Vape'}, {'flavor': 'Blueberry Watermelon', 'nicotine': '50MG', 'pack count': '5 Pack', 'size': '26ml', 'price': '$46.7', 'stock': 139, 'quantity': 'Decrease Quantity of Artery CL6 Sweet & Ice Control Vape\nIncrease Quantity of Artery CL6 Sweet & Ice Control Vape'}]"
Viho Turbo 10000 Vape,https://cdn11.bigcommerce.com/s-hqim8tz8ly/products/67528/images/93153/avida-cbd-vape-charger_1__01827.1713292960.386.513.jpg?c=2,https://vaperanger.com/products/viho-turbo-10000-puffs,"Experience VIHO Turbo, a wholesale pack of 5 premium disposable vapes delivering extended satisfaction. With 50MG nicotine, 17ml e-liquid, and 850mAh battery, enjoy hassle-free vaping. With a nicotine content of 50MG (5.0%) by volume, these disposable vapes provide a satisfying throat hit and smooth nicotine delivery. Each device comes pre-filled with 17ml of e-liquid, eliminating the need for messy refills and ensuring a hassle-free vaping experience.","['Available in 5 Pack for your convenience.', '50MG (5.0%) Nicotine by Volume for a satisfying experience.', '17ml Pre-Filled E-Liquid ensuring extended use.', 'Approximately 10000 Puffs Per Device with each Viho Turbo vape.', '850mAh Integrated Battery for long-lasting performance with Viho Turbo reliability.', 'Banana Icy: Cool banana bliss with an icy twist, perfect for a refreshing treat.', 'Blue Razz Icy: Refreshing blue raspberry chill that invigorates your senses.', 'La Mint: A minty delight with a touch of sweetness for a balanced flavor.', 'Lemon Mint: Zesty lemon meets refreshing mint in this invigorating Viho Turbo blend.', 'Mango Icy: Tropical mango sensation on ice, delivering a Viho Turbo escape to paradise.', 'Passion Fruit Icy: Exotic passion fruit with a cool breeze, offering an adventurous Viho Turbo experience.', 'Peach Icy: Juicy peach perfection with a refreshing kick to delight your taste buds.', 'Sour Apple Icy: Tangy sour apple with an icy blast, creating a bold Viho Turbo refreshment.', 'Strawmelon Icy: A chilling blend of sweet strawberry and watermelon for a perfectly balanced icy treat.', 'Watermelon Icy: Refreshing watermelon goodness on ice, a classic Viho Turbo favorite.', '']","[{'flavor': 'White Gummy', 'nicotine': '50MG', 'pack count': '5 Pack', 'size': '17ml', 'price': '$47', 'stock': 46, 'quantity': 'Decrease Quantity of Viho Turbo 10000 Vape\nIncrease Quantity of Viho Turbo 10000 Vape'}, {'flavor': 'Cherry Lemon', 'nicotine': '50MG', 'pack count': '5 Pack', 'size': '17ml', 'price': '$47', 'stock': 18, 'quantity': 'Decrease Quantity of Viho Turbo 10000 Vape\nIncrease Quantity of Viho Turbo 10000 Vape'}, {'flavor': 'Tropical Melon', 'nicotine': '50MG', 'pack count': '5 Pack', 'size': '17ml', 'price': '$47', 'stock': 14, 'quantity': 'Decrease Quantity of Viho Turbo 10000 Vape\nIncrease Quantity of Viho Turbo 10000 Vape'}, {'flavor': 'Watermelon Cactus Jack', 'nicotine': '50MG', 'pack count': '5 Pack', 'size': '17ml', 'price': '$47', 'stock': 11, 'quantity': 'Decrease Quantity of Viho Turbo 10000 Vape\nIncrease Quantity of Viho Turbo 10000 Vape'}, {'flavor': 'Glacier Oreo', 'nicotine': '50MG', 'pack count': '5 Pack', 'size': '17ml', 'price': '$47', 'stock': 6, 'quantity': 'Decrease Quantity of Viho Turbo 10000 Vape\nIncrease Quantity of Viho Turbo 10000 Vape'}, {'flavor': 'Razz Watermelon', 'nicotine': '50MG', 'pack count': '5 Pack', 'size': '17ml', 'price': '$47', 'stock': 4, 'quantity': 'Decrease Quantity of Viho Turbo 10000 Vape\nIncrease Quantity of Viho Turbo 10000 Vape'}, {'flavor': 'Strawberry Raspberry', 'nicotine': '50MG', 'pack count': '5 Pack', 'size': '17ml', 'price': '$47', 'stock': 'Unavailable', 'quantity': 'Notify Me'}, {'flavor': 'Cherry Berry', 'nicotine': '50MG', 'pack count': '5 Pack', 'size': '17ml', 'price': '$47', 'stock': 'Unavailable', 'quantity': 'Notify Me'}]"
Fume Eternity 20000 Vape,https://cdn11.bigcommerce.com/s-hqim8tz8ly/products/72070/images/115405/Fume_Eternity_20K_Vape_13__32418.1729178951.386.513.jpg?c=2,https://vaperanger.com/products/fume-eternity-20k-vape,"Fume Eternity 20000 Vape delivers an outstanding vaping experience with up to 20,000 puffs. With a 30ml e-liquid capacity, this device provides extended use without frequent refills. The 5% nicotine strength ensures robust hits, while the dual mesh coil guarantees smooth vapor production and rich flavors. Its LED screen displays real-time information, making it a reliable choice for your wholesale offerings.","['20,000 Puffs: Long-lasting device with an impressive puff count.', '30ml E-Liquid Capacity: Pre-filled with premium e-juice for extended use.', '5% Nicotine Strength (50mg): Delivers a strong, satisfying hit.', 'Dual Vaping Modes:\nRegular Mode: Offers up to 20,000 puffs.\nPulse Mode: Provides an intense experience with around 10,000 puffs.', 'Regular Mode: Offers up to 20,000 puffs.', 'Pulse Mode: Provides an intense experience with around 10,000 puffs.', '700mAh Rechargeable Battery: Ensures consistent power with USB-C charging.', 'Dual Mesh Coil: Delivers rich flavor and smooth vapor production.', 'LED Screen: Displays real-time battery and e-liquid levels.', '17 Flavors: Includes 4 invigorating iced options.', 'Black Ice: Bold blackberries meet icy menthol for a refreshing vape.', 'Blueberry Kiwi Watermelon: A tropical mix of blueberries, kiwi, and watermelon.', 'Candy Strawberry: Sugary sweet strawberry candy flavor.', 'Clear: Pure, straightforward, high-nicotine satisfaction.', 'Ice Mint: A crisp and invigorating minty burst.', 'Lush Ice: Juicy watermelon blended with a cool menthol finish.', 'Mix Fruit Ice: Assorted fruits with a cooling ice touch.', 'Peach Banana: Sweet peaches paired with creamy bananas.', 'Peach Watermelon Berry: Peaches, watermelon, and mixed berries for a fruity explosion.', 'Pineapple Ice: Sweet pineapple with an icy menthol finish.', 'Refresh: A revitalizing menthol blend for an uplifting experience.', 'Strawberry Banana: A classic blend of sweet strawberries and bananas.', 'Strawberry Kiwi Apricot: A unique fusion of strawberries, kiwi, and apricot.', 'Strawberry Pina Colada: Tropical strawberries, coconut, and pineapple.', 'Strawberry Watermelon: Sweet strawberries with refreshing watermelon.', 'Tropicanna: A juicy medley of tropical fruits.', 'Watermelon Berry: A refreshing mix of watermelon and sweet berries.']","[{'flavor': 'Blueberry Kiwi Watermelon', 'nicotine': '50MG', 'pack count': '5 Pack', 'size': '30ml', 'price': '$37.5', 'stock': 11, 'quantity': 'Decrease Quantity of Fume Eternity 20000 Vape\nIncrease Quantity of Fume Eternity 20000 Vape'}, {'flavor': 'Strawberry Kiwi Apricot', 'nicotine': '50MG', 'pack count': '5 Pack', 'size': '30ml', 'price': '$37.5', 'stock': 9, 'quantity': 'Decrease Quantity of Fume Eternity 20000 Vape\nIncrease Quantity of Fume Eternity 20000 Vape'}, {'flavor': 'Mix Fruit Ice', 'nicotine': '50MG', 'pack count': '5 Pack', 'size': '30ml', 'price': '$37.5', 'stock': 9, 'quantity': 'Decrease Quantity of Fume Eternity 20000 Vape\nIncrease Quantity of Fume Eternity 20000 Vape'}, {'flavor': 'Strawberry Pina Colada', 'nicotine': '50MG', 'pack count': '5 Pack', 'size': '30ml', 'price': '$37.5', 'stock': 8, 'quantity': 'Decrease Quantity of Fume Eternity 20000 Vape\nIncrease Quantity of Fume Eternity 20000 Vape'}, {'flavor': 'Strawberry Banana', 'nicotine': '50MG', 'pack count': '5 Pack', 'size': '30ml', 'price': '$37.5', 'stock': 7, 'quantity': 'Decrease Quantity of Fume Eternity 20000 Vape\nIncrease Quantity of Fume Eternity 20000 Vape'}, {'flavor': 'Strawberry Watermelon', 'nicotine': '50MG', 'pack count': '5 Pack', 'size': '30ml', 'price': '$37.5', 'stock': 6, 'quantity': 'Decrease Quantity of Fume Eternity 20000 Vape\nIncrease Quantity of Fume Eternity 20000 Vape'}, {'flavor': 'Refresh', 'nicotine': '50MG', 'pack count': '5 Pack', 'size': '30ml', 'price': '$37.5', 'stock': 6, 'quantity': 'Decrease Quantity of Fume Eternity 20000 Vape\nIncrease Quantity of Fume Eternity 20000 Vape'}, {'flavor': 'Tropicanna', 'nicotine': '50MG', 'pack count': '5 Pack', 'size': '30ml', 'price': '$37.5', 'stock': 4, 'quantity': 'Decrease Quantity of Fume Eternity 20000 Vape\nIncrease Quantity of Fume Eternity 20000 Vape'}, {'flavor': 'Candy Strawberry', 'nicotine': '50MG', 'pack count': '5 Pack', 'size': '30ml', 'price': '$37.5', 'stock': 4, 'quantity': 'Decrease Quantity of Fume Eternity 20000 Vape\nIncrease Quantity of Fume Eternity 20000 Vape'}, {'flavor': 'Peach Watermelon Berry', 'nicotine': '50MG', 'pack count': '5 Pack', 'size': '30ml', 'price': '$37.5', 'stock': 2, 'quantity': 'Decrease Quantity of Fume Eternity 20000 Vape\nIncrease Quantity of Fume Eternity 20000 Vape'}, {'flavor': 'Watermelon Berry', 'nicotine': '50MG', 'pack count': '5 Pack', 'size': '30ml', 'price': '$37.5', 'stock': 'Unavailable', 'quantity': 'Notify Me'}, {'flavor': 'Pineapple Ice', 'nicotine': '50MG', 'pack count': '5 Pack', 'size': '30ml', 'price': '$37.5', 'stock': 'Unavailable', 'quantity': 'Notify Me'}, {'flavor': 'Peach Banana', 'nicotine': '50MG', 'pack count': '5 Pack', 'size': '30ml', 'price': '$37.5', 'stock': 'Unavailable', 'quantity': 'Notify Me'}, {'flavor': 'Lush Ice', 'nicotine': '50MG', 'pack count': '5 Pack', 'size': '30ml', 'price': '$37.5', 'stock': 'Unavailable', 'quantity': 'Notify Me'}, {'flavor': 'Ice Mint', 'nicotine': '50MG', 'pack count': '5 Pack', 'size': '30ml', 'price': '$37.5', 'stock': 'Unavailable', 'quantity': 'Notify Me'}, {'flavor': 'Clear', 'nicotine': '50MG', 'pack count': '5 Pack', 'size': '30ml', 'price': '$37.5', 'stock': 'Unavailable', 'quantity': 'Notify Me'}, {'flavor': 'Black Ice', 'nicotine': '50MG', 'pack count': '5 Pack', 'size': '30ml', 'price': '$37.5', 'stock': 'Unavailable', 'quantity': 'Notify Me'}]"
Rare Mega Disposable Vape - 5000 Puffs,https://cdn11.bigcommerce.com/s-hqim8tz8ly/products/48962/images/59298/Disenosintitulo-6_12c3703b-c226-47b7-95b2-82b4e07727c9__63500.1713292866.386.513.jpg?c=2,https://vaperanger.com/products/rare-mega-disposable-vape-pen,"Unleash the power of Rare Mega Disposable Vape, boasting 5000 puffs, 50MG nicotine strength, and a formidable 2000mAh integrated battery. With 10ml of pre-filled e-liquid, this device offers an extended and flavorful vaping journey. Embrace the convenience of a disposable, non-refillable, and non-rechargeable solution.","['50MG (5.0%) Nicotine by Volume.', '10ml Pre-Filled E-Liquid.', 'Approximately 5000 Puffs Per Device.', '2000mAh Integrated Battery.', 'Disposable - Non-Refillable & Non-Rechargeable.', 'Blackberry Strawberry: A berry duet of dark allure, Blackberry Strawberry blends sweetness with a touch of tart.', 'Blue Raz Slushy: Dive into a refreshing ocean of blue raspberry delight with the cool essence of a slushy.', ""Cotton Candy: Experience the whimsy of fairground delights with Cotton Candy's sugary and fluffy sweetness."", 'Donkey Kahn: Surrender to the exotic allure of Donkey Kahn, where strawberry, banana, and dragon fruit dance.', 'Grape Aloe: Grape Aloe beckons with the luscious taste of grapes balanced by the soothing essence of aloe.', 'Hawaiian Freeze: Immerse yourself in tropical bliss with Hawaiian Freeze, a wave of exotic fruits and coolness.', 'Peach Ice: Savor the juicy sweetness of ripe peaches kissed by a refreshing breeze in Peach Ice.', 'Strawberry Bubblegum Ice: Indulge in nostalgia with Strawberry Bubblegum Ice, a frosty fusion of berries and gum.', 'Lush Ice: Cool off with Lush Ice, a menthol-infused watermelon wonder that delivers a crisp chill.', ""Strawberry Watermelon Bubblegum: A trifecta of sweetness unfolds in Strawberry Watermelon Bubblegum's juicy embrace."", 'Summer Berries: Revel in the vibrant medley of Summer Berries, a burst of sun-kissed berries in every vape.', 'Tropical Blue Raz: Embark on a journey to the tropics with Tropical Blue Raz, a blend of exotic fruits and blue raspberry.', 'Watermelon Gummy Bear: Dive into nostalgia with Watermelon Gummy Bear, a blend of watermelon and chewy sweetness.']","[{'flavor': 'Grape Aloe', 'nicotine': '50MG', 'pack count': '10 Pack', 'size': '10ml', 'price': '$66', 'stock': 77, 'quantity': 'Decrease Quantity of Rare Mega Disposable Vape - 5000 Puffs\nIncrease Quantity of Rare Mega Disposable Vape - 5000 Puffs'}, {'flavor': 'Donkey Kahn', 'nicotine': '50MG', 'pack count': '10 Pack', 'size': '10ml', 'price': '$66', 'stock': 77, 'quantity': 'Decrease Quantity of Rare Mega Disposable Vape - 5000 Puffs\nIncrease Quantity of Rare Mega Disposable Vape - 5000 Puffs'}, {'flavor': 'Tropical Blue Raz', 'nicotine': '50MG', 'pack count': '10 Pack', 'size': '10ml', 'price': '$66', 'stock': 68, 'quantity': 'Decrease Quantity of Rare Mega Disposable Vape - 5000 Puffs\nIncrease Quantity of Rare Mega Disposable Vape - 5000 Puffs'}, {'flavor': 'Cotton Candy', 'nicotine': '50MG', 'pack count': '10 Pack', 'size': '10ml', 'price': '$66', 'stock': 61, 'quantity': 'Decrease Quantity of Rare Mega Disposable Vape - 5000 Puffs\nIncrease Quantity of Rare Mega Disposable Vape - 5000 Puffs'}, {'flavor': 'Blackberry Strawberry', 'nicotine': '50MG', 'pack count': '10 Pack', 'size': '10ml', 'price': '$66', 'stock': 58, 'quantity': 'Decrease Quantity of Rare Mega Disposable Vape - 5000 Puffs\nIncrease Quantity of Rare Mega Disposable Vape - 5000 Puffs'}, {'flavor': 'Watermelon Gummy Bear', 'nicotine': '50MG', 'pack count': '10 Pack', 'size': '10ml', 'price': '$66', 'stock': 51, 'quantity': 'Decrease Quantity of Rare Mega Disposable Vape - 5000 Puffs\nIncrease Quantity of Rare Mega Disposable Vape - 5000 Puffs'}, {'flavor': 'Strawberry Watermelon Bubblegum', 'nicotine': '50MG', 'pack count': '10 Pack', 'size': '10ml', 'price': '$66', 'stock': 40, 'quantity': 'Decrease Quantity of Rare Mega Disposable Vape - 5000 Puffs\nIncrease Quantity of Rare Mega Disposable Vape - 5000 Puffs'}, {'flavor': 'Summer Berries', 'nicotine': '50MG', 'pack count': '10 Pack', 'size': '10ml', 'price': '$66', 'stock': 37, 'quantity': 'Decrease Quantity of Rare Mega Disposable Vape - 5000 Puffs\nIncrease Quantity of Rare Mega Disposable Vape - 5000 Puffs'}, {'flavor': 'Strawberry Bubblegum Ice', 'nicotine': '50MG', 'pack count': '10 Pack', 'size': '10ml', 'price': '$66', 'stock': 32, 'quantity': 'Decrease Quantity of Rare Mega Disposable Vape - 5000 Puffs\nIncrease Quantity of Rare Mega Disposable Vape - 5000 Puffs'}, {'flavor': 'Lush Ice', 'nicotine': '50MG', 'pack count': '10 Pack', 'size': '10ml', 'price': '$66', 'stock': 29, 'quantity': 'Decrease Quantity of Rare Mega Disposable Vape - 5000 Puffs\nIncrease Quantity of Rare Mega Disposable Vape - 5000 Puffs'}, {'flavor': 'Peach Ice', 'nicotine': '50MG', 'pack count': '10 Pack', 'size': '10ml', 'price': '$66', 'stock': 24, 'quantity': 'Decrease Quantity of Rare Mega Disposable Vape - 5000 Puffs\nIncrease Quantity of Rare Mega Disposable Vape - 5000 Puffs'}, {'flavor': 'Blue Raz Slushy', 'nicotine': '50MG', 'pack count': '10 Pack', 'size': '10ml', 'price': '$66', 'stock': 14, 'quantity': 'Decrease Quantity of Rare Mega Disposable Vape - 5000 Puffs\nIncrease Quantity of Rare Mega Disposable Vape - 5000 Puffs'}, {'flavor': 'Hawaiian Freeze', 'nicotine': '50MG', 'pack count': '10 Pack', 'size': '10ml', 'price': '$66', 'stock': 8, 'quantity': 'Decrease Quantity of Rare Mega Disposable Vape - 5000 Puffs\nIncrease Quantity of Rare Mega Disposable Vape - 5000 Puffs'}]"
