title,image_url,product_link,inner_product_description,inner_feature_description,table_details
Cali UL8000 3% Disposable Vape,https://cdn11.bigcommerce.com/s-hqim8tz8ly/products/72296/images/117517/Cali_Pods_Disposable_Vape_15__59809.1716556501.1280.1280__32106.1732713589.386.513.jpg?c=2,https://vaperanger.com/products/cali-ul8000-3-disposable-vape,"The Cali UL8000 3% Disposable Vape delivers up to 8,000 puffs of smooth, flavorful vapor. Featuring an 18ml pre-filled e-liquid capacity and a 600mAh integrated battery, it provides long-lasting enjoyment. The rechargeable design ensures that users can enjoy every last puff. Perfect for both beginners and experienced vapers, this disposable vape is a convenient option for those seeking portability and quality in one device.","['30MG (3.0%) Nicotine by Volume', '18mL Pre-Filled E-Liquid', 'Approximately 8,000 Puffs Per Device', '600mAh Integrated Battery', 'Disposable – Non-Refillable & Rechargeable', 'Blue Raspberry Lemonade: A sweet and tangy fusion of blue raspberry and lemonade for a refreshing vape.', 'Frozen Apple Watermelon: Crisp apple and juicy watermelon, enhanced with a cool frozen finish.', 'Frozen Blackberry: Rich blackberry flavor, paired with a chill for the ultimate refreshing experience.', 'Frozen Blue Raspberry: Tangy blue raspberry flavor with an icy twist.', 'Frozen Grape: A sweet grape flavor cooled to perfection.', 'Frozen Lush: A delicious blend of melon and tropical fruit, frozen for a cool hit.', 'Frozen Peach: Juicy peach flavor complemented by a refreshing icy exhale.', 'Frozen Strawberry Raspberry: A sweet mix of strawberry and raspberry with a frosty finish.', 'Mighty Mint: A fresh mint flavor with a cooling sensation.', 'Peach Watermelon: A tropical blend of juicy peach and refreshing watermelon.', 'Pineapple Splash: A zesty pineapple flavor with a splash of citrus.', 'Pineapple Strawberry Banana: A tropical blend of pineapple, strawberry, and banana for a smooth experience.', 'Strawberry Banana: A classic duo of ripe strawberries and creamy banana.', 'Strawberry Kiwi: A tangy mix of strawberry and kiwi for a fruity vape experience.']","[{'flavor': 'Strawberry Kiwi', 'nicotine': '30MG', 'pack count': '6 Pack', 'size': '18ml', 'price': '$56.25', 'stock': 984, 'quantity': 'Decrease Quantity of Cali UL8000 3% Disposable Vape\nIncrease Quantity of Cali UL8000 3% Disposable Vape'}, {'flavor': 'Frozen Peach', 'nicotine': '30MG', 'pack count': '6 Pack', 'size': '18ml', 'price': '$56.25', 'stock': 980, 'quantity': 'Decrease Quantity of Cali UL8000 3% Disposable Vape\nIncrease Quantity of Cali UL8000 3% Disposable Vape'}, {'flavor': 'Frozen Apple Watermelon', 'nicotine': '30MG', 'pack count': '6 Pack', 'size': '18ml', 'price': '$56.25', 'stock': 980, 'quantity': 'Decrease Quantity of Cali UL8000 3% Disposable Vape\nIncrease Quantity of Cali UL8000 3% Disposable Vape'}, {'flavor': 'Frozen Lush', 'nicotine': '30MG', 'pack count': '6 Pack', 'size': '18ml', 'price': '$56.25', 'stock': 974, 'quantity': 'Decrease Quantity of Cali UL8000 3% Disposable Vape\nIncrease Quantity of Cali UL8000 3% Disposable Vape'}, {'flavor': 'Frozen Blue Raspberry', 'nicotine': '30MG', 'pack count': '6 Pack', 'size': '18ml', 'price': '$56.25', 'stock': 973, 'quantity': 'Decrease Quantity of Cali UL8000 3% Disposable Vape\nIncrease Quantity of Cali UL8000 3% Disposable Vape'}, {'flavor': 'Pineapple Strawberry Banana', 'nicotine': '30MG', 'pack count': '6 Pack', 'size': '18ml', 'price': '$56.25', 'stock': 972, 'quantity': 'Decrease Quantity of Cali UL8000 3% Disposable Vape\nIncrease Quantity of Cali UL8000 3% Disposable Vape'}, {'flavor': 'Pineapple Splash', 'nicotine': '30MG', 'pack count': '6 Pack', 'size': '18ml', 'price': '$56.25', 'stock': 971, 'quantity': 'Decrease Quantity of Cali UL8000 3% Disposable Vape\nIncrease Quantity of Cali UL8000 3% Disposable Vape'}, {'flavor': 'Blue Raspberry Lemonade', 'nicotine': '30MG', 'pack count': '6 Pack', 'size': '18ml', 'price': '$56.25', 'stock': 971, 'quantity': 'Decrease Quantity of Cali UL8000 3% Disposable Vape\nIncrease Quantity of Cali UL8000 3% Disposable Vape'}, {'flavor': 'Frozen Grape', 'nicotine': '30MG', 'pack count': '6 Pack', 'size': '18ml', 'price': '$56.25', 'stock': 970, 'quantity': 'Decrease Quantity of Cali UL8000 3% Disposable Vape\nIncrease Quantity of Cali UL8000 3% Disposable Vape'}, {'flavor': 'Frozen Blackberry', 'nicotine': '30MG', 'pack count': '6 Pack', 'size': '18ml', 'price': '$56.25', 'stock': 970, 'quantity': 'Decrease Quantity of Cali UL8000 3% Disposable Vape\nIncrease Quantity of Cali UL8000 3% Disposable Vape'}, {'flavor': 'Strawberry Banana', 'nicotine': '30MG', 'pack count': '6 Pack', 'size': '18ml', 'price': '$56.25', 'stock': 969, 'quantity': 'Decrease Quantity of Cali UL8000 3% Disposable Vape\nIncrease Quantity of Cali UL8000 3% Disposable Vape'}, {'flavor': 'Peach Watermelon', 'nicotine': '30MG', 'pack count': '6 Pack', 'size': '18ml', 'price': '$56.25', 'stock': 969, 'quantity': 'Decrease Quantity of Cali UL8000 3% Disposable Vape\nIncrease Quantity of Cali UL8000 3% Disposable Vape'}, {'flavor': 'Frozen Strawberry Raspberry', 'nicotine': '30MG', 'pack count': '6 Pack', 'size': '18ml', 'price': '$56.25', 'stock': 965, 'quantity': 'Decrease Quantity of Cali UL8000 3% Disposable Vape\nIncrease Quantity of Cali UL8000 3% Disposable Vape'}, {'flavor': 'Mighty Mint', 'nicotine': '30MG', 'pack count': '6 Pack', 'size': '18ml', 'price': '$56.25', 'stock': 'Unavailable', 'quantity': 'Notify Me'}]"
Wynn Bar 4 Adjust 50000 Disposable,https://cdn11.bigcommerce.com/s-hqim8tz8ly/products/72546/images/119786/Diseo_sin_ttulo__62515.1739969761.386.513.jpg?c=2,https://vaperanger.com/products/wynn-bar-4-adjust-50k-disposable,"The Wynn Bar 4 Adjust 50000 Disposable redefines vaping with 50,000 puffs, a large e-liquid capacity, and a unique 4-adjust system. Vape enthusiasts can fine-tune ice, sweetness, nicotine, and voltage for their perfect hit. Powered by an 880mAh rechargeable battery and USB Type-C charging, this disposable is designed for extended use and maximum satisfaction, making it a top choice for anyone seeking a versatile, high-performance vape.","['World’s First 4-Adjustable Disposable Vape', '880mAh Rechargeable Battery', 'Adjustable Ice, Sweetness, Nicotine, and Output Voltage', 'Large E-Liquid Capacity for up to 50,000 Puffs (20,000 in Boost Mode)', '5% Nicotine Strength (50mg)', 'USB Type-C Charging (Cable Not Included)', 'Berries Cheese Cake: A creamy, berry-infused dessert flavor with a rich cheesecake base.', 'Blue Razz Ice: A tart, refreshing blue raspberry flavor with a cool ice finish.', 'Blue Razz Watermelon Ice: A sweet blend of blue raspberry and juicy watermelon with an icy twist.', 'Cinnamon Banana Cream Pie: Warm cinnamon and creamy banana pie flavors with a hint of spice.', 'Juicy Peach: Fresh, sweet peach flavor with a succulent taste.', 'Miami Mint: A vibrant mint flavor that cools and refreshes with every puff.', 'Peach Berry Ice: A delightful mix of juicy peach and sweet berries with an icy coolness.', 'Pineapple Apple Pear: Tropical pineapple mixed with crisp apple and juicy pear.', 'Sakura Grape: A sweet blend of ripe grapes with a floral sakura twist.', 'Sour Apple: Tart green apple flavor with a sharp, sour kick.', 'Strawberry Banana: The classic combo of ripe strawberries and creamy banana.', 'Strawberry Kiwi Ice: A tangy kiwi and sweet strawberry mix, finished with an icy chill.', 'Strawberry Watermelon: Juicy strawberries paired with refreshing watermelon.', 'Watermelon Ice: A cool, hydrating watermelon flavor with an icy finish.', 'White Gummy Ice: Sweet white gummy candy flavor with a cool minty touch.']","[{'flavor': 'Strawberry Kiwi Ice', 'nicotine': '50MG', 'pack count': '5 Pack', 'size': '26ml', 'price': '$48.33', 'stock': 1057, 'quantity': 'Decrease Quantity of Wynn Bar 4 Adjust 50000 Disposable\nIncrease Quantity of Wynn Bar 4 Adjust 50000 Disposable'}, {'flavor': 'Sour Apple', 'nicotine': '50MG', 'pack count': '5 Pack', 'size': '26ml', 'price': '$48.33', 'stock': 1056, 'quantity': 'Decrease Quantity of Wynn Bar 4 Adjust 50000 Disposable\nIncrease Quantity of Wynn Bar 4 Adjust 50000 Disposable'}, {'flavor': 'White Gummy Ice', 'nicotine': '50MG', 'pack count': '5 Pack', 'size': '26ml', 'price': '$48.33', 'stock': 1051, 'quantity': 'Decrease Quantity of Wynn Bar 4 Adjust 50000 Disposable\nIncrease Quantity of Wynn Bar 4 Adjust 50000 Disposable'}, {'flavor': 'Peach Berry Ice', 'nicotine': '50MG', 'pack count': '5 Pack', 'size': '26ml', 'price': '$48.33', 'stock': 1047, 'quantity': 'Decrease Quantity of Wynn Bar 4 Adjust 50000 Disposable\nIncrease Quantity of Wynn Bar 4 Adjust 50000 Disposable'}, {'flavor': 'Watermelon Ice', 'nicotine': '50MG', 'pack count': '5 Pack', 'size': '26ml', 'price': '$48.33', 'stock': 1045, 'quantity': 'Decrease Quantity of Wynn Bar 4 Adjust 50000 Disposable\nIncrease Quantity of Wynn Bar 4 Adjust 50000 Disposable'}, {'flavor': 'Sakura Grape', 'nicotine': '50MG', 'pack count': '5 Pack', 'size': '26ml', 'price': '$48.33', 'stock': 1044, 'quantity': 'Decrease Quantity of Wynn Bar 4 Adjust 50000 Disposable\nIncrease Quantity of Wynn Bar 4 Adjust 50000 Disposable'}, {'flavor': 'Pineapple Apple Pear', 'nicotine': '50MG', 'pack count': '5 Pack', 'size': '26ml', 'price': '$48.33', 'stock': 1044, 'quantity': 'Decrease Quantity of Wynn Bar 4 Adjust 50000 Disposable\nIncrease Quantity of Wynn Bar 4 Adjust 50000 Disposable'}, {'flavor': 'Juicy Peach', 'nicotine': '50MG', 'pack count': '5 Pack', 'size': '26ml', 'price': '$48.33', 'stock': 1044, 'quantity': 'Decrease Quantity of Wynn Bar 4 Adjust 50000 Disposable\nIncrease Quantity of Wynn Bar 4 Adjust 50000 Disposable'}, {'flavor': 'Miami Mint', 'nicotine': '50MG', 'pack count': '5 Pack', 'size': '26ml', 'price': '$48.33', 'stock': 1038, 'quantity': 'Decrease Quantity of Wynn Bar 4 Adjust 50000 Disposable\nIncrease Quantity of Wynn Bar 4 Adjust 50000 Disposable'}, {'flavor': 'Cinnamon Banana Cream Pie', 'nicotine': '50MG', 'pack count': '5 Pack', 'size': '26ml', 'price': '$48.33', 'stock': 1035, 'quantity': 'Decrease Quantity of Wynn Bar 4 Adjust 50000 Disposable\nIncrease Quantity of Wynn Bar 4 Adjust 50000 Disposable'}, {'flavor': 'Blue Razz Watermelon Ice', 'nicotine': '50MG', 'pack count': '5 Pack', 'size': '26ml', 'price': '$48.33', 'stock': 1035, 'quantity': 'Decrease Quantity of Wynn Bar 4 Adjust 50000 Disposable\nIncrease Quantity of Wynn Bar 4 Adjust 50000 Disposable'}, {'flavor': 'Strawberry Watermelon', 'nicotine': '50MG', 'pack count': '5 Pack', 'size': '26ml', 'price': '$48.33', 'stock': 1032, 'quantity': 'Decrease Quantity of Wynn Bar 4 Adjust 50000 Disposable\nIncrease Quantity of Wynn Bar 4 Adjust 50000 Disposable'}, {'flavor': 'Blue Razz Ice', 'nicotine': '50MG', 'pack count': '5 Pack', 'size': '26ml', 'price': '$48.33', 'stock': 1032, 'quantity': 'Decrease Quantity of Wynn Bar 4 Adjust 50000 Disposable\nIncrease Quantity of Wynn Bar 4 Adjust 50000 Disposable'}, {'flavor': 'Strawberry Banana', 'nicotine': '50MG', 'pack count': '5 Pack', 'size': '26ml', 'price': '$48.33', 'stock': 1028, 'quantity': 'Decrease Quantity of Wynn Bar 4 Adjust 50000 Disposable\nIncrease Quantity of Wynn Bar 4 Adjust 50000 Disposable'}, {'flavor': 'Berries Cheese Cake', 'nicotine': '50MG', 'pack count': '5 Pack', 'size': '26ml', 'price': '$48.33', 'stock': 1025, 'quantity': 'Decrease Quantity of Wynn Bar 4 Adjust 50000 Disposable\nIncrease Quantity of Wynn Bar 4 Adjust 50000 Disposable'}]"
Geek Bar Meloso Max 9000 Disposable,https://cdn11.bigcommerce.com/s-hqim8tz8ly/products/67673/images/119146/Geek_Bar_Meloso_Max_Disposable_Vape_-_9000_Puffs__63656__99186.1738011120.386.513.jpg?c=2,https://vaperanger.com/products/geek-bar-meloso-max-disposable-vape,"The Geek Bar Meloso Max 9000 Disposable offers an exceptional vaping experience with its dual mesh coil, 14ml e-liquid capacity, and 9000 puffs. Featuring 5% NIC salt nicotine and a 600mAh Type-C rechargeable battery, this disposable vape provides robust flavor and long-lasting use, making it a top choice for vapers seeking a high-performance device.","['Dual Mesh Coil.', 'Pre-filled 14ml E-Liquid.', 'Puffs Count: 9000 Puffs.', 'NIC Salt Nicotine: 5%(50mg).', 'Battery: 600mAh Type-C Rechargeable Battery.', 'Strawberry Mango: Sweet strawberry meets tropical mango bliss.', 'Ginger Ale: Refreshing blend of spicy ginger and fizzy ale.', 'Strawberry Watermelon: Juicy strawberries mixed with refreshing watermelon.', 'Strawberry Ice: Chilled strawberry delight with an icy twist.', 'Fuji Melon Ice: Crisp Fuji apple meets juicy melon with a cooling finish.', 'Watermelon Ice: Refreshing watermelon with a cool menthol kick.', 'Peach Ice: Ripe peaches with a refreshing icy touch.', 'Green Monster: A tantalizing fusion of exotic fruits and refreshing coolness.', 'Stone Freeze: Frosty mix of fruits for an icy cool sensation.', 'Clear: Clean and pure flavor for a refreshing vape.', 'Tropical Rainbow Blast: Tropical fruits blend into a vibrant rainbow explosion.', 'Sour Apple Ice: Tangy green apple with a chilly menthol blast.', 'Cool Mint: Refreshing mint flavor for a cool and crisp vape.', 'Berry Trio Ice: A trio of juicy berries with an icy coolness.']","[{'flavor': 'Berry Trio Ice', 'nicotine': '50MG', 'pack count': '5 Pack', 'size': '14ml', 'price': '$48', 'stock': 'Unavailable', 'quantity': 'Notify Me'}, {'flavor': 'Cool Mint', 'nicotine': '50MG', 'pack count': '5 Pack', 'size': '14ml', 'price': '$48', 'stock': 'Unavailable', 'quantity': 'Notify Me'}, {'flavor': 'Sour Apple Ice', 'nicotine': '50MG', 'pack count': '5 Pack', 'size': '14ml', 'price': '$48', 'stock': 'Unavailable', 'quantity': 'Notify Me'}, {'flavor': 'Tropical Rainbow Blast', 'nicotine': '50MG', 'pack count': '5 Pack', 'size': '14ml', 'price': '$48', 'stock': 'Unavailable', 'quantity': 'Notify Me'}, {'flavor': 'Stone Freeze', 'nicotine': '50MG', 'pack count': '5 Pack', 'size': '14ml', 'price': '$48', 'stock': 'Unavailable', 'quantity': 'Notify Me'}, {'flavor': 'Green Monster', 'nicotine': '50MG', 'pack count': '5 Pack', 'size': '14ml', 'price': '$48', 'stock': 'Unavailable', 'quantity': 'Notify Me'}, {'flavor': 'Peach Ice', 'nicotine': '50MG', 'pack count': '5 Pack', 'size': '14ml', 'price': '$48', 'stock': 'Unavailable', 'quantity': 'Notify Me'}, {'flavor': 'Watermelon Ice', 'nicotine': '50MG', 'pack count': '5 Pack', 'size': '14ml', 'price': '$48', 'stock': 'Unavailable', 'quantity': 'Notify Me'}, {'flavor': 'Fuji Melon Ice', 'nicotine': '50MG', 'pack count': '5 Pack', 'size': '14ml', 'price': '$48', 'stock': 'Unavailable', 'quantity': 'Notify Me'}, {'flavor': 'Strawberry Ice', 'nicotine': '50MG', 'pack count': '5 Pack', 'size': '14ml', 'price': '$48', 'stock': 'Unavailable', 'quantity': 'Notify Me'}, {'flavor': 'Strawberry Watermelon', 'nicotine': '50MG', 'pack count': '5 Pack', 'size': '14ml', 'price': '$48', 'stock': 'Unavailable', 'quantity': 'Notify Me'}, {'flavor': 'Ginger Ale', 'nicotine': '50MG', 'pack count': '5 Pack', 'size': '14ml', 'price': '$48', 'stock': 'Unavailable', 'quantity': 'Notify Me'}, {'flavor': 'Strawberry Mango', 'nicotine': '50MG', 'pack count': '5 Pack', 'size': '14ml', 'price': '$48', 'stock': 'Unavailable', 'quantity': 'Notify Me'}]"
Elf Bar BC5000 Zero Nicotine Disposable,https://cdn11.bigcommerce.com/s-hqim8tz8ly/products/68164/images/96081/E.B_Design_BC5000_Zero_Nic_Disposable_Vape_Pen_-_5000_Puffs__48023.1721828634.386.513.jpg?c=2,https://vaperanger.com/products/e-b-design-bc5000-zero-nic-disposable-vape,"The Elf Bar BC5000 Zero Nicotine provides up to 5000 puffs of pure flavor with a 13ml e-liquid capacity. Featuring 0MG nicotine, it’s perfect for those who enjoy the taste without nicotine. The device is disposable yet rechargeable with Type-C, ensuring convenience and consistent performance for a smooth vaping experience.","['Available in 10 Pack.', '0MG (0.0%) Nicotine by Volume.', '13ml Pre-Filled E-Liquid.', 'Approximately 5000 Puffs Per Device.', '650mAh Integrated Battery.', 'Disposable - Non-Refillable & - Rechargeable.', 'Type C Charging.', 'Blue Razz Ice: A chilly fusion of tangy blue raspberry with an icy blast, invigorating and refreshing.', 'Cranberry Grape: Bold grape meets tart cranberry in a harmonious fruit blend.', ""Miami Mint: Cool, vibrant minty breeze evokes the essence of Miami's tropical allure."", 'Peach Mango Watermelon: Luscious trio of ripe peach, succulent mango, and juicy watermelon.', 'Rainbow Candy: A burst of sweet nostalgia, a medley of vibrant and sugary candy flavors.', 'Strawberry Banana: Classic duo of ripe strawberries and creamy bananas, pure fruit delight.', 'Strawberry Kiwi: Succulent strawberries intertwined with zesty, tropical kiwi, a balanced blend.', 'Strawberry Mango: Ripe strawberries embrace the exotic essence of juicy mango, a tropical symphony.', 'Tropical Rainbow Blast: Explosive blend of tropical fruits creates a vibrant, palate-dazzling explosion.', 'Watermelon Ice: Juicy watermelon with an invigorating icy twist, summer in a refreshing puff.']","[{'flavor': 'Strawberry Kiwi', 'nicotine': '0MG', 'pack count': '10 Pack', 'size': '13ml', 'price': '$66.5', 'stock': 50, 'quantity': 'Decrease Quantity of Elf Bar BC5000 Zero Nicotine Disposable\nIncrease Quantity of Elf Bar BC5000 Zero Nicotine Disposable'}, {'flavor': 'Strawberry Banana', 'nicotine': '0MG', 'pack count': '10 Pack', 'size': '13ml', 'price': '$66.5', 'stock': 14, 'quantity': 'Decrease Quantity of Elf Bar BC5000 Zero Nicotine Disposable\nIncrease Quantity of Elf Bar BC5000 Zero Nicotine Disposable'}, {'flavor': 'Watermelon Ice', 'nicotine': '0MG', 'pack count': '10 Pack', 'size': '13ml', 'price': '$66.5', 'stock': 'Unavailable', 'quantity': 'Notify Me'}, {'flavor': 'Tropical Rainbow Blast', 'nicotine': '0MG', 'pack count': '10 Pack', 'size': '13ml', 'price': '$66.5', 'stock': 'Unavailable', 'quantity': 'Notify Me'}, {'flavor': 'Strawberry Mango', 'nicotine': '0MG', 'pack count': '10 Pack', 'size': '13ml', 'price': '$66.5', 'stock': 'Unavailable', 'quantity': 'Notify Me'}, {'flavor': 'Rainbow Candy', 'nicotine': '0MG', 'pack count': '10 Pack', 'size': '13ml', 'price': '$66.5', 'stock': 'Unavailable', 'quantity': 'Notify Me'}, {'flavor': 'Peach Mango Watermelon', 'nicotine': '0MG', 'pack count': '10 Pack', 'size': '13ml', 'price': '$66.5', 'stock': 'Unavailable', 'quantity': 'Notify Me'}, {'flavor': 'Miami Mint', 'nicotine': '0MG', 'pack count': '10 Pack', 'size': '13ml', 'price': '$66.5', 'stock': 'Unavailable', 'quantity': 'Notify Me'}, {'flavor': 'Cranberry Grape', 'nicotine': '0MG', 'pack count': '10 Pack', 'size': '13ml', 'price': '$66.5', 'stock': 'Unavailable', 'quantity': 'Notify Me'}, {'flavor': 'Blue Razz Ice', 'nicotine': '0MG', 'pack count': '10 Pack', 'size': '13ml', 'price': '$66.5', 'stock': 'Unavailable', 'quantity': 'Notify Me'}]"
Space Mary SM8000 Vape,https://cdn11.bigcommerce.com/s-hqim8tz8ly/products/68353/images/96726/avida-cbd-vape-charger__96882.1713292978.386.513.jpg?c=2,https://vaperanger.com/products/space-mary-sm8000-disposable-vape,"Introducing the Space Mary SM8000 Disposable Vape - Place 10-pack orders on a disposable vape pen with approximately 8000 puffs per device. Boasting an 18ml pre-filled e-liquid reservoir infused with 50MG (5.0%) nicotine, this non-refillable and rechargeable device guarantees a flavorful experience every time. Space Mary SM8000 is the embodiment of convenience, elegance, and efficiency, all in one. Get it now at an amazing wholesale price!","['Available in 10 Pack.', '50MG (5.0%) Nicotine by Volume.', '18ml Pre-Filled E-Liquid.', 'Approximately 8000 Puffs Per Device.', 'Disposable - Non-Refillable & Rechargeable.', 'Alaskan Mint: Arctic coolness meets refreshing mint, a frosty symphony of invigoration.', 'Blue Gummy: Chewy nostalgia, a burst of blue gummy candy delight in every puff.', 'Blue Razz: Electric blue raspberry zing, a tangy-sweet flavor explosion that thrills.', 'Blueberry Ice: Chilled blueberry temptation, icy refreshment in every fruit-filled inhale.', 'Bubblegang Berry: Bubblegum joy infused with a mix of luscious berries, a flavorful pop.', 'Cactus Orange: Prickly pear meets zesty orange, an unexpected yet harmonious desert fusion.', 'Cherry Razz Ice: Intense cherry-raspberry duo, chilled for a refreshing frosty twist.', 'Dragon Berry Banana Ice: Exotic dragon fruit, berries, and creamy banana, an icy adventure.', 'Kiwi Dragonfruit: Tropical tang of kiwi entwined with the bold allure of dragon fruit.', 'Pink Cotton Candy: Whimsical pink delight, sugary cotton candy dreams in every puff.', 'Strawberry Ice: Juicy strawberry kissed by a chilly breeze, a frosty fruit delight.', 'Strawberry Kiwi: Classic duo of strawberry and kiwi, a burst of fruity harmony.', 'Strawberry Snowcone: Summer nostalgia, capturing the essence of strawberry snowcones.']","[{'flavor': 'Blue Trio Lemon', 'nicotine': '50MG', 'pack count': '10 Pack', 'size': '18ml', 'price': '$95', 'stock': 167, 'quantity': 'Decrease Quantity of Space Mary SM8000 Vape\nIncrease Quantity of Space Mary SM8000 Vape'}, {'flavor': 'Miami Mint', 'nicotine': '50MG', 'pack count': '10 Pack', 'size': '18ml', 'price': '$95', 'stock': 126, 'quantity': 'Decrease Quantity of Space Mary SM8000 Vape\nIncrease Quantity of Space Mary SM8000 Vape'}, {'flavor': 'Strazz', 'nicotine': '50MG', 'pack count': '10 Pack', 'size': '18ml', 'price': '$95', 'stock': 73, 'quantity': 'Decrease Quantity of Space Mary SM8000 Vape\nIncrease Quantity of Space Mary SM8000 Vape'}, {'flavor': 'Grape Gummy', 'nicotine': '50MG', 'pack count': '10 Pack', 'size': '18ml', 'price': '$95', 'stock': 62, 'quantity': 'Decrease Quantity of Space Mary SM8000 Vape\nIncrease Quantity of Space Mary SM8000 Vape'}, {'flavor': 'Cali Mint', 'nicotine': '50MG', 'pack count': '10 Pack', 'size': '18ml', 'price': '$95', 'stock': 44, 'quantity': 'Decrease Quantity of Space Mary SM8000 Vape\nIncrease Quantity of Space Mary SM8000 Vape'}, {'flavor': 'Kiwi Pomegranate Mango', 'nicotine': '50MG', 'pack count': '10 Pack', 'size': '18ml', 'price': '$95', 'stock': 10, 'quantity': 'Decrease Quantity of Space Mary SM8000 Vape\nIncrease Quantity of Space Mary SM8000 Vape'}, {'flavor': 'Bubblegang Berry', 'nicotine': '50MG', 'pack count': '10 Pack', 'size': '18ml', 'price': '$95', 'stock': 5, 'quantity': 'Decrease Quantity of Space Mary SM8000 Vape\nIncrease Quantity of Space Mary SM8000 Vape'}, {'flavor': 'Razzalada', 'nicotine': '50MG', 'pack count': '10 Pack', 'size': '18ml', 'price': '$95', 'stock': 4, 'quantity': 'Decrease Quantity of Space Mary SM8000 Vape\nIncrease Quantity of Space Mary SM8000 Vape'}, {'flavor': 'Lemonade Chill', 'nicotine': '50MG', 'pack count': '10 Pack', 'size': '18ml', 'price': '$95', 'stock': 4, 'quantity': 'Decrease Quantity of Space Mary SM8000 Vape\nIncrease Quantity of Space Mary SM8000 Vape'}, {'flavor': 'Watermelon Ice', 'nicotine': '50MG', 'pack count': '10 Pack', 'size': '18ml', 'price': '$95', 'stock': 3, 'quantity': 'Decrease Quantity of Space Mary SM8000 Vape\nIncrease Quantity of Space Mary SM8000 Vape'}, {'flavor': 'Strawberry Kiwi', 'nicotine': '50MG', 'pack count': '10 Pack', 'size': '18ml', 'price': '$95', 'stock': 'Unavailable', 'quantity': 'Notify Me'}, {'flavor': 'Strawberry Ice', 'nicotine': '50MG', 'pack count': '10 Pack', 'size': '18ml', 'price': '$95', 'stock': 'Unavailable', 'quantity': 'Notify Me'}, {'flavor': 'Cherry Razz Ice', 'nicotine': '50MG', 'pack count': '10 Pack', 'size': '18ml', 'price': '$95', 'stock': 'Unavailable', 'quantity': 'Notify Me'}, {'flavor': 'Blueberry Ice', 'nicotine': '50MG', 'pack count': '10 Pack', 'size': '18ml', 'price': '$95', 'stock': 'Unavailable', 'quantity': 'Notify Me'}, {'flavor': 'Blue Razz', 'nicotine': '50MG', 'pack count': '10 Pack', 'size': '18ml', 'price': '$95', 'stock': 'Unavailable', 'quantity': 'Notify Me'}, {'flavor': 'Blue Gummy', 'nicotine': '50MG', 'pack count': '10 Pack', 'size': '18ml', 'price': '$95', 'stock': 'Unavailable', 'quantity': 'Notify Me'}]"
